{
  "schemaVersion": 1,
  "authorityKind": "package",
  "authorityId": "example.owner",
  "packageId": "example.owner",
  "contracts": {},
  "retiredPrivateContracts": {
    "minimal": {
      "contractId": "example.rpc.v1.minimal",
      "history": [
        {
          "state": "published",
          "exposure": "package",
          "contractVersion": "2.0.0",
          "descriptorBytes": 487,
          "canonicalDescriptor": "{\"$defs\":{\"Empty\":{\"additionalProperties\":false,\"properties\":{},\"required\":[],\"title\":\"Empty value\",\"type\":\"object\"}},\"$schema\":\"https://json-schema.org/draft/2020-12/schema\",\"contractId\":\"example.rpc.v1.minimal\",\"descriptorVersion\":1,\"errors\":{},\"schemaProfile\":\"sunder.rpc.values.v1\",\"services\":{\"example\":{\"methods\":{\"ping\":{\"errors\":[],\"idempotency\":\"idempotent\",\"kind\":\"unary\",\"requestSchema\":{\"$ref\":\"#/$defs/Empty\"},\"responseSchema\":{\"$ref\":\"#/$defs/Empty\"}}}}},\"version\":\"2.0.0\"}",
          "descriptorSha256": "709c513e8ce97618f8a5fefdf3b7de92c8ed673a7d657ba151b279d527c0d371",
          "abiProjectionBytes": 390,
          "canonicalAbiProjection": "{\"$defs\":{\"Empty\":{\"additionalProperties\":false,\"properties\":{},\"required\":[],\"type\":\"object\"}},\"contractId\":\"example.rpc.v1.minimal\",\"descriptorVersion\":1,\"errors\":{},\"schemaProfile\":\"sunder.rpc.values.v1\",\"services\":{\"example\":{\"methods\":{\"ping\":{\"errors\":[],\"idempotency\":\"idempotent\",\"kind\":\"unary\",\"requestSchema\":{\"$ref\":\"#/$defs/Empty\"},\"responseSchema\":{\"$ref\":\"#/$defs/Empty\"}}}}}}",
          "abiSha256": "999c92cc5041ca77b2acabeab94a5bf0887117a8005ec3fa709564dc95902a42",
          "packageRelease": {
            "packageId": "example.owner",
            "packageVersion": "1.0.0"
          },
          "publication": {
            "registryOrigin": "https://registry.example/",
            "packageId": "example.owner",
            "packageVersion": "1.0.0",
            "packageContentIdentity": "3333333333333333333333333333333333333333333333333333333333333333",
            "publishedAtUtc": "2000-01-01T00:00:00Z",
            "etag": "\"709c513e8ce97618f8a5fefdf3b7de92c8ed673a7d657ba151b279d527c0d371\""
          }
        }
      ]
    }
  }
}
